{
  "schema_version": "handoff-contract.v1",
  "checkpoint_id": "cp-20260427T212054Z-t-001",
  "created_at": "2026-04-27T21:20:54.328Z",
  "trigger": {
    "type": "manual"
  },
  "from_agent": {
    "id": "codex-gpt-5-codex"
  },
  "to_agent": {
    "target": "codex",
    "expected_format": "Codex startup prompt"
  },
  "task": {
    "id": "t-001",
    "goal": "Live Handoff Bridge v1",
    "state": "in_progress",
    "skills": [
      "agent-framework",
      "harness-engineering",
      "memory-systems",
      "advanced-evaluation"
    ],
    "dod": [
      {
        "check": "artifact",
        "path": "handoff-bridge.mjs",
        "passed_at": null
      },
      {
        "check": "artifact",
        "path": "schemas/handoff-contract.v1.json",
        "passed_at": null
      },
      {
        "check": "test",
        "command": "node --test tests\\node-runtime.test.mjs",
        "passed_at": null
      },
      {
        "check": "test",
        "command": "node --test tests\\handoff-bridge.test.mjs",
        "passed_at": null
      },
      {
        "check": "test",
        "command": "node tests\\handoff-roundtrip-sim.mjs",
        "passed_at": null
      },
      {
        "check": "manual",
        "description": "Robin confirms an actual Codex-to-Claude roundtrip",
        "passed_at": null
      }
    ]
  },
  "context_summary": "Claude read Codex's v2 handoff + RESUME.md, verified all 8 artifacts and ran the 30/30 test suite. Now returning observations and open questions to close the bidirectional roundtrip — the real proof that the bridge works both ways, not just Codex→Claude one-way.",
  "completed": [
    "Read .omc/state/checkpoints/codex-to-claude-live-v2.handoff.json (schema-valid, contract.v1)",
    "Read .omc/state/checkpoints/codex-to-claude-live-v2.RESUME.md (actionable, points to PROTOCOL.md + TASKS.json + handoff JSON)",
    "Verified 8 artifacts exist with expected sizes (handoff-bridge.mjs 14.9KB, schema 3.7KB, node-runtime 4.9KB, etc)",
    "Ran node --test tests/node-runtime.test.mjs tests/agents-task.test.mjs tests/handoff-bridge.test.mjs → 30/30 green on local Node",
    "Confirmed Compound Protocol + Handoff Bridge form a coherent autonomous-build foundation; First Usable Autonomous Build milestone effectively reached"
  ],
  "pending": [
    "Acknowledge in your next response that you saw THIS Claude→Codex checkpoint — that proves the roundtrip is bidirectional, which is the real test (Robin's exact challenge)",
    "Answer Robin's three open questions: (1) push 3595ed1 Compound Protocol commit? (2) have you pushed your handoff-bridge commits to origin/main or only local? (3) is Token Budget Tracker the agreed t-002?",
    "If you accept t-002 = Token Budget Tracker, open it via task.mjs open with appropriate skills + DoD; v1 should ship --trigger=token adapter only, no auto-firing yet"
  ],
  "current_files": [
    "handoff-bridge.mjs",
    "schemas/handoff-contract.v1.json",
    ".agents/node-runtime.mjs",
    ".agents/PROTOCOL.md",
    ".omc/state/checkpoints/codex-to-claude-live-v2.handoff.json"
  ],
  "decisions": [
    "Roundtrip is bidirectional by design — v1 one-way proof is insufficient; ultimate test is Codex picks up Claude's checkpoint and references its content",
    "Manual DoD check 'Robin confirms an actual Codex-to-Claude roundtrip' closes when Codex demonstrates pick-up of THIS message in his response",
    "Token Budget Tracker becomes natural t-002 follow-up — adapter pattern over the now-shipped manual trigger"
  ],
  "risks": [
    "If your session opens a fresh chat without seeing this checkpoint, the bidirectional claim fails and t-001 needs another roundtrip",
    "Three commits potentially unpushed — risk of merge friction if either of us keeps building locally"
  ],
  "commands_run": [],
  "verification": [
    "node --test tests/node-runtime.test.mjs tests/agents-task.test.mjs tests/handoff-bridge.test.mjs → 30/30 pass (claude side, current process Node)",
    "All 8 deliverables enumerated in your handoff verified on disk via ls -la with correct mtime"
  ],
  "ledger": {
    "task_path": ".agents/TASKS.json",
    "task_current": "t-001",
    "task_updated_at": "2026-04-27T20:50:34.153Z"
  },
  "safety": {
    "shareable": true,
    "redactions": []
  }
}
